title,context
"한국경제당, ""더불어민주당 홍성국 후보 즉각 제명해야""",한국경제당은 오늘 정론관 기자회견을 통해 어제 언론에서 대대적으로 보도된 미래통합당 차명진 후보의 세월호 텐트서 발생한 불미스런 일에 대한 막말논란과 세종시에 출마한 더불어민주당 홍성국 후보의 막말 논란과...
"더불어민주당 안산지역후보들, 차명진막말 황교안대표사죄촉구","▲ 인천일보, INCHEONILBO 더불어민주당 안산 4개 선거구 후보들은 9일 ""황교안 대표는 차명진 막말에 대해 세월호 유가족과 안산시민에 사죄하라""라고 촉구했다. 이날 민주당 안산상록갑 전해철·안산상록을 김철민..."
"한국경제당, 더불어민주당 여성 비하 발언 홍성국 후보 제명 요구",한국경제당은 오늘 정론관 기자회견을 통해 어제 언론에서 대대적으로 보도된 미래통합당 차명진 후보의 세월호 텐트서 발생한 불미스런 일에 대한 막말논란과 세종시에 출마한 더불어민주당 홍성국 후보의 막말 논란과...
"더불어민주당 신영대 후보, 금융산업노조와 정책협약 체결","더불어민주당 군산 신영대 후보가 전국금융산업노동조합(위원장 박홍배)과 정책협약을 체결했다. 9일 신 후보와 전국금융산업노조는 협약을 통해 금융공공성 강화, 노동존중 실현, 금융 노동자 자율성 보장 등을 위해 모든..."
(4·15 총선 드론) 김현권 더불어민주당 구미을 후보 ‘청년을 안아주는 구미...,김현권 더불어민주당 구미을 후보.더불어민주당 김현권 구미을 후보가 청년의 꿈을 응원하고 실현을 지원하겠다며 ‘청년을 안아주는 구미’ 공약을 발표했다. 김 후보가 발표한 청년공약은 △청년하이테크 재교육...
4ㆍ15 총선 천안을 더불어민주당 박완주 의원 '직산송전탑 문제 사실왜곡 더 ...,"4ㆍ15 총선 천안을 더불어민주당 박완주 의원(사진)은 9일 도당에서 기자회견을 갖고 ""그동안 직산 송전탑과 관련해 본 의원에 대한 근거 없는 허위비방과 사실 왜곡이 난무해도 항상 인내해 왔다""며 ""근거 없는 비판을..."
"더불어민주당 충남도당, 이낙연 상임공동선대위원장 지원 유세","더불어민주당 CI / 더불어민주당 더불어민주당 충남도당(위원장 어기구, 이하 도당)은 9일 이낙연 상임공동선대위원장이 오는 10일 충남을 찾아 더불어민주당 후보들의 지원에 나선다고 밝혔다. 도당에 따르면, 이..."
"이상익 더불어민주당 함평군수 후보, 홍영표 전 원내대표 등 후보들의 필승 지...","함평군수 보궐선거에 출마한 더불어민주당 이상익 후보 선거대책본부는 9일 함평읍 터미널 사거리에서 홍영표 더불어민주당 전원내대표와 서삼석 국회의원(영암무안신안), 신정훈 후보(나주시화순)를 비롯 도의원, 군의원..."
"이정근 더불어민주당 서초갑 후보, 살기 좋은 서초 공약 추진으로 서초구민의...","-""1가구 1주택자 종합부동산세 부담을 줄이겠다""는 공약을 공동으로 발표 이정근 더불어민주당 서초갑 후보가 21대 총선 D-6일을 앞두고 살기 좋은 서초를 위한 약속을 제시했다. ‘서초도 바꿉시다. 서초를 지킵시다.’는..."
"더불어민주당?더불어시민당-간호협회, 정책협약식 개최","대한간호협회는 9일 국회 본청 더불어민주당 대표실에서 더불어민주당?더불어시민당과 각각 정책협약식을 개최했다. 이번 정책협약식은 전국의 의료기관에서 코로나바이러스감염증-19(이하, 코로나 19) 대응을 위해..."
[서울포토]지원유세에 나선 더불어민주당 이해찬,서울 관악갑에 출마한 유기홍 더불어민주당 후보가 9일 서울 관악구 봉천로 사거리 인근에서 지원유세를 위해 방문한 이해찬 더불어민주당 선거대책위원장을 유권자들에게 소개하고 있다. 2020.4.9
"간협, 더불어민주당·더불어시민당과 정책협약식 개최",9일 대한간호협회는 국회 본청 더불어민주당 대표실에서 더불어민주당·더불어시민당과 각각 정책협약식을 개최했다. 이번 정책협약식은 전국 의료기관에서 코로나19 대응을 위해 현장에서 땀흘리고 있는 간호사들의...
지지를 호소하는 더불어민주당 진선미 후보,4.15 총선 서울 강동갑에 출마한 진선미 더불어민주당 후보가 9일 서울 강동구 암사동 양지마을에서 선거유세를 하고 있다.
[기자회견문] 더불어시민당은 더불어민주당의 유일한 원팀입니다! (2020. 4. ...,"민주당 당원동지, 유권자 여러분들께서 김대중 대통령을 당선시켰던 결기와 기상으로 더불어민주당의 유일한 원팀인 더불어시민당이 반드시 압승할 수 있도록 힘을 모아 주십시오.우리의 선택이 분열되면 야당을..."
"김홍걸 후보 ""더불어시민당만이 더불어민주당과 한 길 가는 정당""","김 위원장은 ""더불어시민당만이 더불어민주당과 한 길을 가는 정당""이라며 ""김대중 대통령과 노무현 대통령, 그리고 문재인 대통령을 당선시켰던 결기와 기상으로 더불어시민당이 반드시 압승할 수 있도록 힘을 모아..."
"김홍걸 ""더불어시민당만이 더불어민주당과 한 길 가는 정당""","김 위원장은 ""전국의 민주당 당원 동지들과 유권자 여러분, 김대중 대통령과 노무현 대통령, 그리고 문재인 대통령을 당선시켰던 결기와 기상으로 더불어시민당이 반드시 압승할 수 있도록 힘을 모아 주십시오""라고..."
"더불어민주당 인천시당, 3호 공약 발표…시민이 행복한 도시를 만들겠습니다!",윤관석 시당위원장 “시민이 존중받고 행복한 도시 인천을 완성시킬 것” 박흥서 기자 phs0506@ajunews.com 더불어민주당 인천시당(위원장 윤관석)은 앞서 총선 제1호 공약인 인천교통혁명 ‘출퇴근 시간 1시간을...
"[격돌 인터뷰-용인병] 정춘숙 더불어민주당 후보 ""16년간 난개발로 지역발전 ...","""일 잘하는 사람, 한다면 하는 사람."" 정춘숙 더불어민주당 용인병 후보가 자신을 표현한 말이다. 이 표현에는 한번 정한 목표를 반드시 이루고, 달성하는 정 후보만의 강력한 추진력에 대한 자신감이 담겨있다. 정 후보는..."
더불어민주당 조성환 후보 독립운동정신으로 조용한 선거 주민호응,"내외뉴스통신, NBNNEWS 더불어민주당 조성환 후보는 공식선거 운동 기간 줄곧 조용한 선거로 코로나19 고통에 동참하는 의미에서 자전거 유세를 이어가고 있다. 선거운동원 없는 자전거 유세는 갈수록 주민들로부터 호응을..."
더불어민주당·더불어시민당-대한간호협회 정책협약식 개최,대한간호협회는 9일 국회 본청 더불어민주당 대표실에서 더불어민주당?더불어시민당과 각각 정책협약식을 개최했다 간호사들의 열악한 근로환경과 처우를 개선하기 위한 움직임이 본격화되고 있다. 대한간호협회는 9일...
신발도 '더불어민주당',이수진 더불어민주당 동작을 후보의 선거사무원이 9일 오후 서울 동작구 상도전통시장을 이 후보와 함께 찾아 기호 1번과 더불어민주당 글자가 새겨진 파란색 신발을 신고 선거운동을 돕고 있다. 2020.4.9/뉴스1
더불어민주당 신발',이수진 더불어민주당 동작을 후보의 선거사무원이 9일 오후 서울 동작구 상도전통시장을 이 후보와 함께 찾아 기호 1번과 더불어민주당 글자가 새겨진 파란색 신발을 신고 선거운동을 돕고 있다. 2020.4.9/뉴스1
신발까지 더불어민주당',이수진 더불어민주당 동작을 후보의 선거사무원이 9일 오후 서울 동작구 상도전통시장을 이 후보와 함께 찾아 기호 1번과 더불어민주당 글자가 새겨진 파란색 신발을 신고 선거운동을 돕고 있다. 2020.4.9/뉴스1
"노무현, 김부겸처럼 험지 도전하는 정치인이 되고 싶다: 더불어민주당 강남병...","김한규: 강남병에 더불어민주당 소속으로 출마한 김한규입니다. 김앤장에서 16년 정도 일했고요, 2년 정도 더불어민주당에서 활동하다가 이번 선거에 나오게 됐습니다. 리: 김앤장에 16년이라니… 돈 많이 버셨겠네요..."
더불어민주당 전북도당-더불어시민당 남원서 공약 발표,더불어민주당 전북도당 선거대책위원회와 더불어시민당이 남원지역 현안인 국립 공공의료대학원 법안을 21대 국회에서 첫 번째로 통과시키기로 약속했다. 양당은 9일 남원시 이강래 후보 선거사무소에서...
[영상]4.15총선 출마자들에게 듣는다! 대전 대덕구 더불어민주당 박영순,대전시 대덕구는 더불어민주당 박영순 후보와 미래통합당 정용기 후보의 양당 대결이 관심을 끌고 있는데요. 두 후보는 대덕구청장과 국회의원 선거 등에서 4번의 대결을 펼쳤고 이번이 5번째 대결입니다. 박영순 후보의...
"이해찬 대표 관악구 지원 유세 ""더불어민주당이 전반적으로 승기를 잡았다""",이해찬 더불어민주당 대표./아시아뉴스통신=박민규기자 [아시아뉴스통신=박민규 기자]더불어 민주당 이해찬 대표가 9일 서울 관악구 유세에 지원을 나섰다.?이 대표는 이날 관악을 정태호 후보와 관압갑 유기홍 후보를...
"더불어민주당-더불어시민당, 남원서 공약 발표",더불어민주당 전북도당 선거대책위원회와 더불어시민당이 9일 남원시 이강래 후보 선거사무소에서 정책공약발표회를 열었다. 2020.4.9 [민주당 전북도당 제공. 재판매 및 DB 금지]
"더불어민주당, 영등포(갑) 김영주 후보 ""장애인들을 위한 정책 펼칠 것""","김영주 후보가 9일 오전 11시 리드릭(영등포 장애인 보호 작업장)을 방문했다.사진제공/김영주 의원실 [아시아뉴스통신=김은해 기자]김영주 후보가 9일 오전 11시 리드릭(영등포 장애인 보호 작업장, 영등포구 양산로..."
지지 호소하는 더불어민주당 윤건영 구로구을 후보,제21대 국회의원선거 구로구을에 출마한 더불어민주당 윤건영 후보가 9일 오후 서울 구로구 신도림역 삼거리 인근에서 지지를 호소하고 있다.
더불어민주당 윤건영 구로구을 후보 차량 유세,제21대 국회의원선거 구로구을에 출마한 더불어민주당 윤건영 후보가 9일 오후 서울 구로구 신도림역 삼거리 인근에서 지지를 호소하고 있다.
"더불어민주당, 고양(을) 한준호 후보, 굴뚝 없는 스타트업·벤처특구 신도시 ...",더불어민주당 고양(을) 한준호 후보를 임종석 전 청와대 비서실장이 지원 유세를 하고 있다. 사진제공 /한준호 후보 캠프 [아시아뉴스통신=김은해 기자]한준호 후보가 고양(을)지역구에 속해있는 창릉 3기 신도시를...
시민에게 음료 건네받는 윤건영 더불어민주당 후보,제21대 국회의원선거 구로구을에 출마한 더불어민주당 윤건영 후보가 9일 오후 서울 구로구 신도림역 삼거리 인근에서 한 시민에게 음료를 건네받고 있다.
지지 호소하는 윤건영 더불어민주당 구로구을 후보,제21대 국회의원선거 구로구을에 출마한 더불어민주당 윤건영 후보가 9일 오후 서울 구로구 신도림역 삼거리 인근에서 지지를 호소하고 있다.
차량 유세하는 윤건영 더불어민주당 구로구을 후보,제21대 국회의원선거 구로구을에 출마한 더불어민주당 윤건영 후보가 9일 오후 서울 구로구 신도림역 삼거리 인근에서 지지를 호소하고 있다.
한 시민과 인사하는 더불어민주당 윤건영 구로구을 후보,제21대 국회의원선거 구로구을에 출마한 더불어민주당 윤건영 후보가 9일 오후 서울 구로구 신도림역 삼거리 인근에서 한 시민과 인사하고 있다.
"[총선]전국금융산업노동조합, 신영대 더불어민주당 군산시 후보 지지선언",신영대 더불어민주당 군산시 후보는 전국금융산업노동조합과 정책 협약을 체결했다고 9일 밝혔다. 전국금융산업노동조합은 이날 신영대 후보 선거 사무소를 찾아? “신영대 후보가 금융산업 공공성 강화와 노동존중사회...
"더불어민주당 충주시 의원 일동, "" '미술품 무단 반출' 이종배 의원, 사퇴하라...","더불어민주당 충주시 의원들은 9일 충주시청 10층 남한강회의실에서 '미술품절도' 명의 기자회견을 열고 ""충주시 예산으로 산 미술품 무단반출한 이종배 의원은 창피하지 않느냐?""고 일갈 했다. 이날 민주당 충주시..."
[포토] 출근길 시민들과 인사하는 고민정 더불어민주당 후보,제21대 총선에서 광진을에 출마하는 고민정 더불어민주당 후보가 9일 오전 서울 광진구 자양동 주민들과 인사하고 있다. / 손진영기자 son@ 제21대 총선에서 광진을에 출마하는 고민정 더불어민주당 후보가 9일 오전...
"[진안군수 재선거]김원기 전 국회의장, 전춘성 더불어민주당 후보 지지 유세 ...",김원기 전 국회의장이 전춘성 더불어민주당 진안군수 후보에게 힘을 보탰다. 김원기 전 의장은 9일 진안 장날을 맞아 전춘성 후보 사무실을 방문했다. 김 전 의장은 안한수 진안군노인회 회장 일행과 전춘성 후보 승리를...
"고병수 ""더불어민주당 송재호, 송순실인가""",국회의원선거 제주시 갑 지역구에 나서는 정의당 고병수 선거대책위원회가 같은 지역구 송재호 후보(더불어민주당)를 향해 '송순실'이라는 표현을 썼다. 문재인 대통령이 4.3 추념식에 참석한 사안을 두고 송재호 후보자...
"민주당 전라북도당-더불어시민당, 남원서 공약발표","이날 남원임실순창 선거구 이강래 후보 선거사무소에서 정책공약발표회와 선대위 전체회의를 갖고 ""더불어민주당과 더불어시민당이 원팀이 되어 이번 총선에서 반드시 승리해 전북 성공시대와 문재인 정부의 성공을..."
21대 국회의원 선거 더불어민주당 계양갑·을 합동 선거대책위원회 회의 개최,"지난 8일 오전 제21대 국회의원선거 더불어민주당 계양갑을 합동 선거대책위원회 회의가 개최되었다.?이 자리에서 계양갑 유동수 후보(제20대 국회 인천계양갑 의원, 정무위원회 간사)는 ""송영길 후보는 민주당의..."
[영상]4.15총선 출마자들에게 듣는다! 대전시 중구 더불어민주당 황운하,대전지방경찰청 출신 더불어민주당 황운하 후보와 미래통합당 이은권 후보가 대결을 펼치고 있습니다. 최근 실시된 여론조사에서 두 후보는 오차범위 내에서 접전을 이어가고 있습니다. 두 후보 모두 대전 중구의 원도심...
[영상]4.15총선 출마자들에게 듣는다! 더불어민주당 대전 서구(을) 박범계,"더불어민주당 박범계 후보는 이번에 3선 성공에 도전하고 있는데요 박 후보는 ""집권 여당에 힘을 실어 코로나19로 어수선해진 국정을 회복할 수 있도록 도와 달라""고 당부했습니다. 박 후보의 선거에 임하는 자세를..."
"[포토]이낙연 더불어민주당 후보, '국난극복, 종로 도약'",4·15 총선 서울 종로에 출마한 이낙연 더불어민주당 후보가 9일 오전 종로구 지하철 동묘앞역 인근에서 차량유세를 하고 있다. 방인권
[포토]이낙연 더불어민주당 후보 돕는 선거운동원들,4·15 총선 서울 종로에 출마한 이낙연 더불어민주당 후보의 선거운동원들이 9일 오전 종로구 지하철 동묘앞역 인근에서 선거운동을 하고 있다. 방인권
[포토]이낙연 더불어민주당 후보 지켜보는 시민들,9일 오전 종로구 지하철 동묘앞역 인근에서 열린 이낙연 더불어민주당 종로구 후보 차량유세를 시민들이 지켜보고 있다. 방인권
[포토]이낙연 더불어민주당 후보 지켜보는 유권자,9일 오전 종로구 지하철 동묘앞역 인근에서 열린 이낙연 더불어민주당 종로구 후보 차량유세를 시민들이 지켜보고 있다. 방인권
[포토]이낙연 더불어민주당 종로구 후보 지켜보는 유권자,9일 오전 종로구 지하철 동묘앞역 인근에서 열린 이낙연 더불어민주당 종로구 후보 차량유세를 시민들이 지켜보고 있다. 방인권
[포토]유권자에게 지지 호소하는 이낙연 더불어민주당 종로구 후보,4·15 총선 서울 종로에 출마한 이낙연 더불어민주당 후보가 9일 오전 종로구 지하철 동묘앞역 인근에서 차량유세를 하고 있다. 방인권
"[포토]이낙연 더불어민주당 후보, '기호 1번입니다'",4·15 총선 서울 종로에 출마한 이낙연 더불어민주당 후보가 9일 오전 종로구 지하철 동묘앞역 인근에서 차량유세를 하고 있다. 방인권
"[포토]이낙연 더불어민주당 후보, '기호 1번 손장갑 끼고'",4·15 총선 서울 종로에 출마한 이낙연 더불어민주당 후보가 9일 오전 종로구 지하철 동묘앞역 인근에서 차량유세를 하고 있다. 방인권
[포토]일정표 살펴보는 이낙연 더불어민주당 후보,4·15 총선 서울 종로에 출마한 이낙연 더불어민주당 후보가 9일 오전 종로구 지하철 동묘앞역 인근에서 차량유세를 하고 있다. 방인권
[포토]유권자에게 지지 호소하는 이낙연 더불어민주당 후보,4·15 총선 서울 종로에 출마한 이낙연 더불어민주당 후보가 9일 오전 종로구 지하철 동묘앞역 인근에서 차량유세를 하고 있다. 방인권
[포토]일정표 살펴보는 이낙연 더불어민주당 후보,4·15 총선 서울 종로에 출마한 이낙연 더불어민주당 후보가 9일 오전 종로구 지하철 동묘앞역 인근에서 차량유세를 하고 있다. 방인권
"[포토]이낙연 더불어민주당 종로구 후보, '기호 1번 손장갑 끼고'",4·15 총선 서울 종로에 출마한 이낙연 더불어민주당 후보가 9일 오전 종로구 지하철 동묘앞역 인근에서 차량유세를 하고 있다. 방인권
[포토]동묘역에서 선거유세하는 이낙연 더불어민주당 후보,4·15 총선 서울 종로에 출마한 이낙연 더불어민주당 후보가 9일 오전 종로구 지하철 동묘앞역 인근에서 차량유세를 하고 있다. 방인권
[포토]이낙연 더불어민주당 종로구 후보에 몰린 취재진,4·15 총선 서울 종로에 출마한 이낙연 더불어민주당 후보가 9일 오전 종로구 지하철 동묘앞역 인근에서 차량유세를 하고 있다. 방인권
[포토]이낙연 더불어민주당 후보에 몰린 취재진,4·15 총선 서울 종로에 출마한 이낙연 더불어민주당 후보가 9일 오전 종로구 지하철 동묘앞역 인근에서 차량유세를 하고 있다. 방인권
[포토]발언하는 이낙연 더불어민주당 종로구 후보,4·15 총선 서울 종로에 출마한 이낙연 더불어민주당 후보가 9일 오전 종로구 지하철 동묘앞역 인근에서 차량유세를 하고 있다. 방인권
"[포토]이낙연 더불어민주당 후보, 선거유세",4·15 총선 서울 종로에 출마한 이낙연 더불어민주당 후보가 9일 오전 종로구 지하철 동묘앞역 인근에서 차량유세를 하고 있다. 방인권
[포토]이낙연 더불어민주당 종로구 후보에 쏠린 관심,4·15 총선 서울 종로에 출마한 이낙연 더불어민주당 후보가 9일 오전 종로구 지하철 동묘앞역 인근에서 차량유세를 하고 있다. 방인권
[포토]차량유세하는 이낙연 더불어민주당 종로구 후보,4·15 총선 서울 종로에 출마한 이낙연 더불어민주당 후보가 9일 오전 종로구 지하철 동묘앞역 인근에서 차량유세를 하고 있다. 방인권
[포토]박수치는 이낙연 더불어민주당 종로구 후보,4·15 총선 서울 종로에 출마한 이낙연 더불어민주당 후보가 9일 오전 종로구 지하철 동묘앞역 인근에서 차량유세를 하고 있다. 방인권
“더불어민주당더불어시민당-대한간호협회 공공의료 강화 및 간호인력을 위한...,"대한간호협회는 9일 국회 본청 더불어민주당 대표실에서 더불어민주당더불어시민당과 각각 정책협약식을 개최했다고 밝혔다. 이번 정책협약식은 전국의 의료기관에서 코로나바이러스감염증-19(이하, 코로나 19) 대응을..."
[포토]시민들과 손인사하는 이낙연 더불어민주당 후보,4·15 총선 서울 종로에 출마한 이낙연 더불어민주당 후보가 9일 오전 종로구 지하철 동묘앞역 인근에서 시민들과 인사를 하고 있다. 방인권
[포토뉴스]사전투표독려 퍼포먼스 하는 더불어민주당-더불어시민당,이인영 더불어민주당 공동선대위원장과? 최배근 더불어시민장 공동대표가 9일 오전 국회에서 제21대 총선 사전투표독려 퍼포먼스를 하고 있다.
"더불어민주당 홍성국 세종갑 국회의원 후보, 행정수도 완성 관련 공약 발표","더불어민주당 홍성국 세종갑 국회의원 후보는 9일 행정수도 완성 관련 공약을 발표하고, 미 이전 중앙행정기관 및 위원회를 빠르게 이전을 통해 지체 없는 행정수도를 완성하겠다는 의지를 내비쳤다. / 홍성국 후보 제공..."
"더불어민주당의 정치공작설, 어불성설이다. [선대위 임윤선 상근대변인 논평]",더불어민주당과 친문 인사들이 연일 정치 공작설에 불을 지피고 있다. 선거 승리를 위해서라면 김대업이라도 소환할 기세이다. 더불어민주당 이해찬 대표는 어제 친문 방송인 김어준이 진행하는 팟케스트에 출연해...
더불어민주당·시민당 “의석 과반수 확보해야 전북 발전”,더불어민주당 전북도당과 범여권 비례정당연합인 더불어시민당이 남원에서 합동 선거대책위원회를 열고 4·15총선 승리를 다짐했다. 이날 이강래 민주당 남원·순창·임실 국회의원 후보 선거사무실에서 열린...
"더불어민주당, 막말 사태에 책임지고 사과한 황교안 대표, 이제 사퇴하라","더불어민주당 로고./아시아뉴스통신 DB [아시아뉴스통신=민할렐루야 기자] 9일 오전 더불어민주당 현근택 선대위 대변인은 ""미래통합당의 연일 망언과 막말 퍼레이드가 점입가경""이라고 전하면서 ""지역과 세대...."
"안산시 더불어민주당 후보 일동, 차명진 막말 관련 황교안 사죄 촉구","안산시 더불어민주당 전해철, 김철민, 고영인, 김남국 후보(사진=장병옥 기자) 안산시 더불어민주당 전해철, 김철민, 고영인, 김남국 후보가 합동 기자회견을 갖고 ""황교안 대표는 차명진 막말에 대해 세월호 유가족과..."
"[21대 총선] 더불어민주당 홍익표 후보, 더불어시민당 이소현 후보 공약 시리...","더불어민주당 로고./아시아뉴스통신 DB [아시아뉴스통신=민할렐루야 기자]9일 오전 국회 소통관에서 더불어민주당 홍익표 후보와 더불어시민당 이소현 후보의 공약이 발표되었다.첫째, 어린이 교통안전을 전반적으로..."
"[21대 총선] 더불어민주당 서울 영등포갑 김영주 후보, 더불어시민당 권인숙 ...",더불어민주당 로고./아시아뉴스통신 DB [아시아뉴스통신=민할렐루야 기자]9일 국회 소통관에서 더불어민주당 김영주 후보와 더불어시민당 권인숙 후보는 21대 총선에 대한 공약을 발표했다.▲첫째...
[기자회견문] 더불어민주당-더불어시민당(홍익표-이소현) 공동기자회견 (2020...,더불어민주당 서울 중구성동구갑 국회의원 후보 홍익표입니다.? 더불어시민당 비례대표 후보 이소현입니다. ?? &lt;홍익표 후보&gt;국가가 존재하는 가장 큰 이유는 국민의 안전과 생명을 지키는 일입니다. 그 점에 있어 그동안...
[기자회견문] 더불어민주당-더불어시민당(김영주-권인숙) 공동기자회견 (2020...,더불어민주당 서울 영등포구갑 국회의원 후보 김영주입니다. ? 더불어시민당 비례대표 후보 권인숙입니다. ??????&lt;김영주 후보&gt;세상의 반은 여성입니다. 여성과 남성은 함께 살아가야 합니다. 하지만 함께 살기...
"[총선]안호영 더불어민주당 완주진안무주장수 후보, 사계절 체류 관광도시 재...",안호영 더불어민주당 완주진안무주장수 국회의원 후보는 완진무장을 사계절 체류하는 산림힐링관광 도시로 재도약시키겠다고 약속했다. 안호영 후보는 9일 보도자료를 통해 “풍경이 수려한 완진무장을 하나의...
