title,context
"더불어민주당 이정문 천안병 국회의원 후보, 석오 이동녕 선생 동상 찾아 추모",더불어민주당 이정문 천안병 국회의원 후보가 11일 오전 9시 천안 남부오거리에 위치한 충남지역 대표적 독립운동가인 석오 이동녕 선생 동상을 찾아 추모하고 있다. / 이정문 후보 제공 더불어민주당 이정문 천안병...
(동정)이낙연 더불어민주당 상임공동선대위원장,10일 오후 서울 종로구 부암동주민센터 앞에서 이낙연 더불어민주당 종로구 후보(왼쪽)가 한 시민과 기념사진 촬영을 하고 있다. /아시아뉴스통신=박민규기자 /이낙연 더불어민주당 상임공동선대위원장은 12일 오후 4시...
김기현 전 울산시장 vs 더불어민주당 황운하 대전 중구 국회의원 후보 2라운드...,김기현 전 울산시장(미래통합당 울산 남을 국회의원 후보)가 더불어민주당 황운하 대전 중구 후보의 저격수로 나서며 지난 6.13 지방선거에 이은 2라운드에 돌입했다. 미래통합당 대전광역시당 / ⓒ 뉴스티앤티 김 전 시장은...
(동정)더불어민주당 정일영 인천 연수을 후보,정일영 더불어민주당 인천 연수을 후보(왼쪽)와 이낙연 전 총리(오른쪽) 모습.(사진제공=정일영후보선거사무소) /더불어민주당 정일영 인천 연수을 후보는 12일 오후 4시 30분 전국 최대 격전지로 꼽힌?'인천 연수을'을...
"더불어시민당 ""김의겸, 민주당에 복당 구걸..국민 현혹 말라""","봉 대변인은 ""더불어민주당과 더불어시민당에는 이미 문재인 정부를 성공시킬 소신과 지혜로 무장한 후보들로 가득 차 있다""며 ""양지만을 쫓아다닌 기회주의자들에게 내어줄 자리도 없다""고 강조했다. 또 이해찬 민주당..."
"김승원 수원갑 후보, 더불어민주당 ‘원팀’ 유세 펼쳐","조현철 기자, 김승원 더불어민주당 수원갑 국회의원 후보와 이재준 전 수원시 부시장이 11일 오후 2시 만석공원 제2야외음악당에서 공동유세를 펼쳤다. 김 후보 측 선거사무원들과 더불어민주당 당원들을 포함한 김 후보..."
"4.15총선, '게임/IT'관련 공약 살펴보니 - 더불어민주당편","그 두번째 시간으로 더불어민주당을 살펴본다. ■ 중앙 및 지역별 공약 더불어민주당은 21대 총선 정책공약집을 통해 소프트웨어 강국 Korea의 위상을 세우겠다고 밝히면서 ▲SW중심 스타트업 및 중소, 벤처기업 지원 강화..."
"더불어민주당 중부 3군 임호선 후보 ""혁신도시 정주여건 개선""",더불어민주당 임호선(증평 진천 음성) 후보가 11일 충북혁신도시의 정주여건 개선과 혁신도시-인근 지역간 상생을 도모하는 공약을 내놓았다. 혁신도시는 특히 그동안 정주여건이 미비했던 탓에 공공기관 근무인력의 40...
더불어민주당 4.15 총선 막바지수도권에 지도부 총 화력 지원,10일 오후 서울 종로 부암동 주민센터 앞에서 이낙연 더불어민주당 종로구 후보가 거점 유세에서 지지 호소하고 있다./아시아뉴스통신=박민규기자 [아시아뉴스통신=박민규 기자] 더불어민주당이 4.15 총선이 마지막...
"더불어민주당·더불어시민당, 12일 광주에서 합동유세...지지층 결집 총력전","더불어민주당과 더불어시민당은 4월 8일 오전, 광주에서 합동 선거대책위원회를 개최하고, 일부 후보의 당선 후 복당 주장에 복당은 없다는 불가 방침을 재확인 했다./ⓒ민주당 광주시당 더불어민주당과 더불어시민당이..."
"[총선]더불어민주당 주요 후보들, 신영대 군산시 후보 유세 지원 총 공세","더불어민주당 중앙당 핵심 지도부와 전북지역 주요 후보들이 군산시를 방문해 신영대 후보 지원에 나섰다. 11일 더불어민주당 전해철, 한병도, 김윤덕, 이원택 후보는 나운동 기업은행 사거리, 은파호수공원 등..."
"더불어민주당 이개호 후보, 11일 '영광터미널 매일시장'서 주말 대규모 유세 ...","이개호 후보, ""e-모빌리티 테마파크, e-모빌리티 산업단지 조성을 통한 국내 최고의 e-모빌리티 시티 건설하겠다"" 기호1번 이개호 더불어민주당 담양·함평·영광·장성 국회의원 지역구 후보가 사전투표 마감일인 11일..."
"[21대 총선 여성 공약 분석] 더불어민주당, '여성 폭력 근절'에 초점",21대 국회 총선을 앞두고 더불어민주당이 내놓은 여성정책 공약은?사회적으로 공분을 일으킨 디지털 성범죄 등?여성폭력 근절이 핵심이다.?늘어나는 여성 1인 가구를 위한 공약도?눈에 띈다. 공약은 대체로 정책의...
함량미달의 더불어민주당 후보들. 부끄러움은 누구의 몫인가 [선대위 황규환 ...,"대체 더불어민주당은 국민을 얼마나 우습게 알기에 함량미달, 자질부족의 후보들을 내놓고 버젓이 국민들에게 선택해 달라 하는지 묻고 싶다. ? 지난 5일 서울 도봉을 후보자 토론회에서, 더불어민주당 오기형..."
유세하는 더불어민주당 오영훈 후보,제21대 국회의원 선거 사전투표 마지막날인 11일 오후 제주시 칠성로 인근에서 더불어민주당 오영훈 후보가 유세하고 있다.2020.4.11/뉴스1
민주당·더불어시민당 광주서 12일 합동 유세,"더불어민주당과 비례전담정당인 더불어시민당은 12일 오후 2시 광주 북구 무등도서관 사거리에서 합동유세를 하고 지지층 결집을 위한 총력전에 나선다. 민주당에선 이형석 중앙당공동선대위원장, 이개호..."
[기자회견문] 더불어민주당-더불어시민당 (김상희-박명숙) 공동기자회견 (202...,"안녕하십니까?더불어민주당 경기 부천시병 국회의원 후보 김상희입니다. 더불어시민당 비례대표 후보 박명숙입니다. ? ? &lt;김상희 후보&gt;모든 국민이 건강권이 보장되는 건강한 대한민국, 더불어시민당 박명숙 후보와..."
대구서 더불어민주당 이헌태 후보 선거벽보 훼손,대구에서 더불어민주당 이헌태 국회의원 후보의 선거 벽보가 훼손돼 경찰이 수사에 나섰다. 더불어민주당 이헌태 후보 선거대책위원회는 11일 오전 10시 30분쯤 대구 북구 침산2동 한라스카이빌 앞에 부착된 이헌태...
"[제21대 총선 구로을 인터뷰] 구로에 힘이 되는 사람, 더불어민주당 윤건영 후...","신도림 테크노마트 앞에서 선거 운동 중인 윤건영 후보 [사진 = 이민우 기자, 편집 = 김보관 기자] 1. 지난 20여 년 동안 노무현, 문재인 대통령의 곁에서 청와대 정무기획비서관, 국정상황실장 등을 지내오셨습니다...."
이수진 더불어민주당 동작을 후보 지원 연설하는 이낙연 위원장,이낙연 더불어민주당 상임공동선대위원장이 11일 오후 서울 동작구 중앙대학교 병원 인근에서 이수진 더불어민주당 서울 동작구을 후보 지원 유세 연설을 하고 있다. 2020.4.11/뉴스1
강득구등 안양더불어 민주당후보 안양형 배달앱 만들기로,"배달민족 횡포에 맞서 안양시 3개 선거구의 국회의원 후보 더불어민주당 강득구(만안구), 민병덕(동안구갑), 이재정(동안구을) 후보는 ‘안양형 배달의 민족’인 공공 음식배달 앱을 만들어 지역 경제에 활력을 일으키고..."
"더불어민주당 ""`이해찬 총선 직후 사의` 보도, 사실 아니다""","더불어민주당은 11일 '이해찬 대표가 4.15 총선 직후 임기를 채우지 않고 물러나겠다는 의사를 밝혔다'는 한 언론 보도에 대해 ""전혀 사실이 아니다""고 전했다. 민주당은 이날 기자들에 보낸 문자메시지에서 ""11일 모..."
"더불어민주당, 수도권에서 전방위 유세","총선을 앞둔 마지막 주말인 오늘, 더불어민주당은 총선 최대 승부처로 꼽히는 수도권에서 전방위 유세를 이어갑니다. 이낙연 상임선대위원장은 오늘 낮부터 서울 동작과 서초, 강남을 돌며 지원 유세를 하고, 이인영..."
"[아유경제_정치] 더불어민주당 강남병 김한규 후보 ""사전투표 첫날 오후 투표...",제21대 총선 강남병 더불어민주당 김한규 국회의원 후보는 이달 10일 오후 1시 대치2동주민센터에서 사전투표를 마쳤다. 신종 코로나바이러스 감염증(코로나19) 사태로 투표율이 저조할 것으로 예상되는 우려와 달리...
"[논평] 정우식 선대위 대변인, ""더불어민주당은 윤준병 정읍·고창 국회의원 ...",더불어민주당은 윤준병 정읍·고창 국회의원 후보의 허위사실 공표를 인정한다면 제명하라. 윤준병 후보는 정통 관료를 거친 서울시 행정부시장 출신으로서 허위경력을 사실인양 공표했다. 이는 한 치의 앞을 알 수 없는...
"더불어민주당 최대 194석-미래통합당 최대 150석 기대 | 더불어민주당, 수도권...","4.15 총선에서 더불어민주당과 미래통합당의 자체분석결과 최대 예상의석수가 민주당 194석, 통합당 150석에 이르는 것으로 나타났다. 양 당 모두 제1당을 노리고 있는 가운데 여당은 국난극복, 야당은 여당심판을..."
"더불어민주당 김원이, 민생당 박지원, 정의당 윤소하 후보 유세","제21대 국회의원 선거 목포 지역구에 출마한 더불어민주당 김원이(왼쪽부터), 민생당 박지원, 정의당 윤소하 후보가 10일 오후 전남 목포시 연산동 연산 주공5단지, 연산동 연산 주공5단지, 산정동 신안 비치1차..."
"더불어민주당 “청년 주거복지 확대”, 미래통합당 “신도시 말고 재건축”","더불어민주당이 지금까지 문재인 정부의 정책 기조를 유지하며 주거복지에 초점을 맞췄다면 미래통합당은 세 부담 완화, 3기 신도시 재검토 등 정부의 기존 정책과 반대되는 공약을 앞세웠다. 민생당은 금융당국이 아닌..."
"전북도 선관위, 더불어민주당 윤준병 정읍·고창 국회의원후보 허위사실공표 ...",윤준병 더불어민주당 국회의원후보는 본인의 예비후보자홍보물과 선거공보물에 두 차례에 걸쳐 주요 수상 이력란에 ‘제1회 서울정책인 대상’수상(2002년)과 ‘제1회 대한민국 지방 자치 정책 대상’수상(2016년) 두건을...
"더불어민주당 이정문 천안병 국회의원 후보, 임종석 전 대통령 비서실장 지원...",임종석 전 대통령 비서실장이 10일 정오 12시 쌍용동 이마트 앞에서 더불어민주당 이정문 천안병 국회의원 후보의 유세차에 올라 지원 유세를 하고 있다. / 이정문 후보 제공 더불어민주당 이정문 천안병 국회의원 후보는...
"더불어민주당, '충청권 표심공략' 총출동",10일 이해찬 더불어민주당 대표가 모두 발언을 하고 있다./ⓒ뉴스프리존 4·15 총선을 5일 남겨두고 더불어민주당 지도부는 10일 충남 대전을 찾아 '충청권 표심' 공략에 나섰다. 10일 민주당 이해찬 대표와 이낙연...
"[경기 안양동안을] 더불어민주당 이재정 54.3%, 미래통합당 심재철 35.4%","YTN - 리얼미터 4월 10일 ▲ 경기 안양동안을 여론조사? ⓒ 이종호 4.15 총선 경기 안양동안을 지역구 여론조사 결과 더불어민주당 이재정 후보 54.3%, 미래통합당 심재철 후보 35.4%, 정의당 추혜선 후보 3.6%로..."
[영상] 차량 유세하는 더불어민주당 서울 동작구을 국회의원 후보 이수진,이수진 더불어민주당 서울 동작구을 국회의원 후보가 10일 서울 동작구에서 차량 유세를 하며 시민들을 만나 지지를 호소하고 있다. 2020.04.10 일요서울TV
유세하는 이재정·민병덕·강득구 더불어민주당 후보,"남승진 기자, 제21대 국회의원선거에서 경기 안양시 3개 선거구에 출마한 이재정(동안을)·강득구(만안)·민병덕(동안갑) 더불어민주당 후보가 9일 관내에서 차량유세를 했다. 민병덕 후보는 “지난 10년간 주민들과..."
"남원?임실?순창 더불어민주당 이강래 후보, 마음의 편지 ""미안합니다""",이강래 후보와 유세원들이 부족함을 반성하고 뼈에 새기겠다며 큰절하고있는 모습(사진=더불어민주당 이강래 후보 선거사무소) 더불어민주당 남원?임실?순창 국회의원 이강래 후보측은 9일?'이강래가 드리는 마음의...
"더불어민주당 안양원팀, '안양형 공공배달앱 도입'","더불어민주당 강득구(만안구), 민병덕(동안구갑), 이재정(동안구을) 후보 9일, 안양시 3개 선거구의 국회의원 후보 더불어민주당 강득구(만안구), 민병덕(동안구갑), 이재정(동안구을) 후보는 '안양형 배달의 민족'인 공공..."
[속초]더불어민주당 이동기 후보 사전 투표,"제21대 총선 속초·인제·고성·양양에 출마한 더불어민주당 이동기 후보는 사전투표 첫날인 10일 속초문예회관 투표소에서 부인,어머니와 함게 사전투표를 했다."
[강릉]더불어민주당 '라떼는유세단' 김경수 후보 지원 유세,"더불어민주당 중앙당 유세단인 ‘라떼는 유세단’이 10일 강릉 도심 월화거리를 방문해 김경수 후보 지원유세를 펼쳤다.유세단 단장인 원혜영 의원은 “김경수 후보를 선택하면 재선의 도지사 출신 이광재,한미연합사..."
"안호영 후보, 완주 봉동읍 사전투표 참여...더불어민주당 압승 강조",안호영 후보 사전투표 모습(사진=의원실) 더불어민주당 안호영 국회의원 후보가 문재인 정부의 성공을 위해 이번 총선에서 더불어민주당의 압승이 절대적으로 필요하다고 강조했다. 안호영 후보는 10일 오전 7시 30분경...
"홍영표 더불어민주당 국회의원, 김주영 김포갑 후보 지지 유세",홍영표 더불어민주당 국회의원이 김포를 찾아 김주영 김포갑 후보 지지 유세를 펼쳤다. 홍 의원은 10일 오전 장기역사거리에서 유세 중인 김주영 후보를 찾아 응원을 하고 김포시민들께 지지를 요청했다. 홍 의원은...
"박상혁 더불어민주당 김포을 후보, 김포 북부권 균형발전 공약 발표","박상혁 더불어민주당 김포을 후보는 10일 김포 북부권 읍면지역의 균형발전을 위한 공약을 발표했다. 박 후보는 ""김포 북부의 읍면지역은 엄청난 잠재력을 가지고 있다""며 ""이 가능성들이 발휘된다면 지역이 발전함과..."
"더불어 민주당 의정부(을) 김민철 후보, 배우자와 함께 사전투표","더불어민주당 의정부시(을) 국회의원 김민철 후보가 10일 오전 경기도 의정부시 송산1동주민센터에 마련된 사전투표소에서 배우자와 함께 소중한 한 표를 행사했다. 김 후보는 ""주민들의 소중한 한 표로 의정부의 미래를..."
인사말하는 박성민 더불어민주당 청년대변인,
박성민 더불어민주당 청년대변인 인사말,
더불어민주당 청년대변인 발언 경청하는 전다현-임지혜 공동의장,박성민 더불어민주당 청년대변인의 인사말에 경청하고 있다. 전국대학학생회네트워크는 이날 체결된 협약식에서 대학생 20000여 명이 참여한 설문조사 및 서명운동 결과를 바탕으로 교육부 - 학생 - 학교 3자 협의회...
"더불어민주당 용인시 갑?을?병?정 국회의원 후보들, 조정식 정책위의장에게...","▲ ▲?10일 더불어민주당 용인시 갑을병정 국회의원 후보자들이 조정식 정책위의장에게 정책제안을 했다. 사진은 좌부터 (갑)오세영 후보, (을)김민기 후보, 조정식 의장, (병)정춘숙 후보, (정)이탄희 후보.[용인=오왕석..."
“더불어시민당은 민주당입니다?”...정의당 “중대 불법행위”,"“더불어시민당은 더불어민주당, 미래통합당은 미래한국당입니다?” 4·15 총선 사전투표가 시작된 가운데 투표소에서 모정당과 위성정당을 헷갈려하는 유권자에게 이 둘을 연결지어 안내하고 있다는 주장이 나왔다...."
선관위는 더불어민주당 후보자의 기부행위 의혹에 대해 지체 없이 조사에 나서...,"더불어민주당 경남 창원진해 황기철 후보자의 제3자 기부행위 및 공모 가능성이 제기됐다. 언론보도에 따르면, 황 후보자는 지난 1월 예비후보자 신분으로 한 간담회에 참석했다. 당시 3만원 상당의 오찬이 제공되었는데..."
[21대 총선 인터뷰] 동구·미추홀구을 더불어민주당 남영희 후보,지난 20대 총선 때 더불어민주당 비례대표 후보 33번으로 출마한 경험이 있다. 아래는 남 후보와 인터뷰를 정리한 것이다. ▶21대 총선 출마 이유와 이번 총선의 의미는? 동구·미추홀구을 지역구는 한 분이 12년 동안...
"안호영 ""문재인 정부 성공 위해 더불어민주당 압승 필요""","10일 사전투표 참여...""총선 승리는?'더 잘사는 완진무장'과?'전북 성공시대' 여는 기폭제"" 더불어민주당 안호영 국회의원 후보(전북 완주·진안·무주·장수)가 문재인 정부의 성공을 위해 이번 총선에서 더불어민주당의..."
[횡성]더불어민주당 원경환 후보 사전투표,
지지 호소하는 더불어민주당 이용우 경기 고양시정 후보,제21대 국회의원선거 경기 고양시정에 출마한 더불어민주당 이용우 후보가 10일 경기 고양시 일산동에서 이석현 들러리유세단장과 함께 지지를 호소하고 있다.
지지 호소하는 이용우 더불어민주당 경기 고양시정 후보,제21대 국회의원선거 경기 고양시정에 출마한 더불어민주당 이용우 후보가 10일 경기 고양시 일산동에서 이석현 들러리유세단장과 함께 지지를 호소하고 있다.
한 표 호소하는 이용우 더불어민주당 고양시정 후보,제21대 국회의원선거 경기 고양시정에 출마한 더불어민주당 이용우 후보가 10일 경기 고양시 일산동에서 이석현 들러리유세단장과 함께 지지를 호소하고 있다.
지지 호소하는 더불어민주당 이용우 후보,제21대 국회의원선거 경기 고양시정에 출마한 더불어민주당 이용우 후보가 10일 경기 고양시 일산동에서 이석현 들러리유세단장과 함께 지지를 호소하고 있다.
[4·15 천안시장 보궐선거 후보자 공약·비전 분석 - ①한태선 더불어민주당 ...,"이러한 시점에 천안의 지평을 열 새 천안시장직에 나선 더불어민주당 한태선 후보의 공약과 비전, 그 구체적 내용을 살펴봤다. ◆ 경제위기극복 3대 패키지 공약 경제시장이 되겠다고 강조한 한태선 후보는 청와대-충남도..."
더불어민주당 임종성 후보. 국민들의 궁금증에 대해 공개해명을 하라.[선대위...,"경기도 광주 을에 출마한 더불어민주당 임종성 후보는 TV토론회에서 미래통합당 이종구 후보가 “임 후보의 사실혼 배우자 소유의 빌라 17채를 1채로 만든 것”이라는 지적을 하자, 임 후보는 허위사실이라며..."
민주당 김동완 후보-더불어시민당 김병주 비례후보 공동 공약 발표,"동해-태백-삼척-정선 선거구 더불어민주당 김동완 후보와 비례대표 더불어시민당 김병주 후보는 10일 태백시청 브리핑룸에서 공약 공동 발표 기자회견을 열었다. 두 후보는 “대한민국을 제5대 군사강국으로 육성, 힘을..."
[영상]4.15총선 출마자들에게 듣는다! 대전시 동구 더불어민주당 장철민,"이번에 소개할 후보는 대전 동구에 출마한 더불어민주당 장철민 후보입니다. 장 후보는 36세의 젊은 나이와 패기, 집권 여당의 힘을 강점으로 3선에 도전하는 미래통합당 이장우 후보에게 도전장을 내밀었는데요. 서대전..."
"더불어민주당 용인지역 국회의원 후보 4명, 용인발전을 위한 정책 제안","▲ 인천일보, INCHEONILBO 더불어민주당 용인 갑을병정 선거구에 출마한 더불어민주당 오세영, 김민기, 정춘숙, 이탄희 후보는 10일 정책위원회 조정식 의장을 만나 용인시 발전에 필요한 정책들을 제안했다. 조정식..."
"더불어민주당 용인시 갑 을 병 정 후보들, 정책위 의장에 용인발전 정책 제안","조정식 의장 “용인 산적 현안 해결, 집권여당 후보 4명 모두 선출해주셔야” 김병관 기자, 용인시 갑 을 병 정 선거구에 출마한 더불어민주당 오세영, 김민기, 정춘숙, 이탄희 후보는 더불어민주당의 정책 입안 통로인..."
"더불어민주당 강원도당, 홍횡영평 선거구 선거유세 방해 선관위 고발","이에?대해?더불어민주당?강원도당은?10일?오후?2시?20분?경,?홍횡영평?선거구?더불어민주당?원경환?후보선거유세장에서?지원유세를?위해?도착한?더불어민주당?중앙당?'라떼는?유세단(단장?원혜영?국회의원..."
"더불어민주당 강원도당, 조일현 무소속 후보(홍·횡·영·평) 선거구 선거유세...","더불어민주당 강원도당은 10일 오후 2시 20분쯤 홍횡영평 선거구 더불어민주당 원경환 후보선거유세장에서 지원유세로 온 '라떼는 유세단(단장 원혜영 국회의원, 이화영 전 국회의원)'에게 욕설과 몸싸움 등으로..."
"더불어민주당, 수도권 91곳 이상 승리 전망",더불어민주당 이근형 전략기획위원장이 121개 의석이 걸린 수도권 총선에서 민주당이 91석 이상을 얻을 수 있을 것으로 전망했다. 이 위원장은 10일 국회에서 기자간담회를 열고 수도권 판세와 관련해 “(직전 총선에서)...
지지호소하는 고민정 더불어민주당 후보,제21대 국회의원선거 광진을에 출마한 고민정 더불어민주당 후보가 10일 오후 서울 광진구 화양제일시장에서 시민들에게 지지를 호소하고 있다. 2020.04.10. amin2@newsis.com 공감언론 뉴시스가 독자 여러분의...
더불어민주당 이철휘 후보 사전투표,"4·15총선 사전투표일인 10일 오전 포천동 포천문화원 대강당 3층에 마련된 투표소에서 더불어민주당 이철휘 후보는 부인 이경원씨와 함께 사전투표했다. 사전투표 후 이 후보는 ""'코로나 19' 사태로 사회적 거리 두기를..."
[아통 포토] 사전 투표하는 더불어민주당 서재헌 후보,서재헌 더불어민주당 대구 동구갑 후보가 10일 오전 동구청 내 신암5동 사전투표소에서 부인과 함께 투표하고 있다. (사진제공=서재헌 후보 사무소) jrpark69@naver.com
더불어민주당 세종시갑 홍성국 후보는 왜 기생충이 되려하는가[선대위 황규환...,"여성을 비하하고, 성 도덕 불감증으로 일관한 더불어민주당 세종시갑 홍성국 후보의 새로운 막말 영상이 등장했다. 한 강연장에서 촬영된 영상에서 홍 후보는 “국회의원 당신네 얼마나 죄 짓는 줄 아느냐”며 “기생충..."
"더불어민주당 휘발유, 경유, LPG 등 상대가격 조정 반대",하지만 집권 여당인 더불어민주당은 각론에 있어 산업계와 소비자 영향을 고려한 정책 속도조절이 필요하다는 입장을 내비쳤고 정의당과 녹색당은 보다 급진적인 에너지전환과 탄소감축이 추진돼야 한다고 답해...
"더불어민주당 송옥주, 이원욱, 권칠승 후보 새솔동에서 합동유세",더불어민주당 송옥주(화성갑)ㆍ이원욱(화성을)ㆍ권칠승(화성병) 국회의원 후보는 지난 9일 오후 6시 화성시 새솔동 중심거리인 수노을중앙로 일대에서 합동유세를 벌였다. 이날 합동 유세에는 화성지역 세 후보를 비롯해...
"성비하, 왜곡 논란 일으킨 여권실세 변호한 자를 검찰개혁이라며 1호 전략공천...",더불어민주당은 조국을 낙마시킨 주광덕 의원을 잡겠다고 김용민 변호사를 남양주에 전략공천했다.? 하지만 그의 실체는 한 여중생을 단지 성적 도구로만 여긴 탁현민 전 행정관의 변호를 맡았던 자로 밝혀졌다....
"더불어민주당 파주(갑,을) ""윤후덕, 박정 ...농축어민을 위한 기본수당 협약""","더불어민주당 파주시(갑·을) 윤후덕(갑), 박정(을) 두 국회의원 후보는 9일 저녁 박정후보 사무실에서 파주시 농축어업인들의 어려움을 함께 공감하여 최소한의 안정적 생활을 지켜주기 위한 일환으로..."
"더불어민주당 김민석 후보, 돌아오려면 밀린 추징금부터 내고 오시라. [선대위...",다름아닌 더불어민주당 영등포을 김민석 후보다. ? 김 후보는 지난 2007년과 2008년 지인에게서 7억2000만원의 불법 정치 자금을 받은 혐의로 벌금 600만원과 추징금 7억2000만원을 선고받았다. 하지만 김 후보는 10년이...
